{
  "schema_version": 1,
  "chart_id": "test-chart-v1",
  "seed": 20260716,
  "bpm": 120,
  "beats_per_bar": 4,
  "duration_ms": 40500,
  "phrases": [
    {
      "id": 0,
      "start_ms": 0,
      "end_ms": 8000,
      "start_beat": 0,
      "end_beat": 16,
      "bars": 4,
      "section": "main"
    },
    {
      "id": 1,
      "start_ms": 8000,
      "end_ms": 16000,
      "start_beat": 16,
      "end_beat": 32,
      "bars": 4,
      "section": "main"
    },
    {
      "id": 2,
      "start_ms": 16000,
      "end_ms": 24000,
      "start_beat": 32,
      "end_beat": 48,
      "bars": 4,
      "section": "main"
    },
    {
      "id": 3,
      "start_ms": 24000,
      "end_ms": 32000,
      "start_beat": 48,
      "end_beat": 64,
      "bars": 4,
      "section": "chorus"
    },
    {
      "id": 4,
      "start_ms": 32000,
      "end_ms": 40000,
      "start_beat": 64,
      "end_beat": 80,
      "bars": 4,
      "section": "main"
    }
  ],
  "notes": [
    {
      "id": "n000",
      "type": "tap",
      "lane": 1,
      "time_ms": 0,
      "duration_ms": 0,
      "phrase": 0,
      "accent": true,
      "section": "intro"
    },
    {
      "id": "n001",
      "type": "tap",
      "lane": 3,
      "time_ms": 1000,
      "duration_ms": 0,
      "phrase": 0,
      "accent": false,
      "section": "intro"
    },
    {
      "id": "n002",
      "type": "tap",
      "lane": 0,
      "time_ms": 1250,
      "duration_ms": 0,
      "phrase": 0,
      "accent": false,
      "section": "intro"
    },
    {
      "id": "n003",
      "type": "tap",
      "lane": 1,
      "time_ms": 2000,
      "duration_ms": 0,
      "phrase": 0,
      "accent": true,
      "section": "intro"
    },
    {
      "id": "n004",
      "type": "tap",
      "lane": 3,
      "time_ms": 3000,
      "duration_ms": 0,
      "phrase": 0,
      "accent": false,
      "section": "intro"
    },
    {
      "id": "n005",
      "type": "tap",
      "lane": 0,
      "time_ms": 3250,
      "duration_ms": 0,
      "phrase": 0,
      "accent": false,
      "section": "intro"
    },
    {
      "id": "n006",
      "type": "tap",
      "lane": 1,
      "time_ms": 4000,
      "duration_ms": 0,
      "phrase": 0,
      "accent": true,
      "section": "intro"
    },
    {
      "id": "n007",
      "type": "hold",
      "lane": 3,
      "time_ms": 4125,
      "duration_ms": 750,
      "phrase": 0,
      "accent": false,
      "section": "intro"
    },
    {
      "id": "n008",
      "type": "tap",
      "lane": 0,
      "time_ms": 4500,
      "duration_ms": 0,
      "phrase": 0,
      "accent": false,
      "section": "intro"
    },
    {
      "id": "n009",
      "type": "tap",
      "lane": 3,
      "time_ms": 5000,
      "duration_ms": 0,
      "phrase": 0,
      "accent": false,
      "section": "intro"
    },
    {
      "id": "n010",
      "type": "tap",
      "lane": 0,
      "time_ms": 5250,
      "duration_ms": 0,
      "phrase": 0,
      "accent": false,
      "section": "intro"
    },
    {
      "id": "n011",
      "type": "tap",
      "lane": 2,
      "time_ms": 5500,
      "duration_ms": 0,
      "phrase": 0,
      "accent": false,
      "section": "intro"
    },
    {
      "id": "n012",
      "type": "tap",
      "lane": 1,
      "time_ms": 6000,
      "duration_ms": 0,
      "phrase": 0,
      "accent": true,
      "section": "intro"
    },
    {
      "id": "n013",
      "type": "chord",
      "lane": 0,
      "time_ms": 6250,
      "duration_ms": 0,
      "phrase": 0,
      "accent": false,
      "section": "intro",
      "lanes": [
        0,
        2
      ]
    },
    {
      "id": "n014",
      "type": "tap",
      "lane": 0,
      "time_ms": 6500,
      "duration_ms": 0,
      "phrase": 0,
      "accent": false,
      "section": "intro"
    },
    {
      "id": "n015",
      "type": "tap",
      "lane": 3,
      "time_ms": 7000,
      "duration_ms": 0,
      "phrase": 0,
      "accent": false,
      "section": "intro"
    },
    {
      "id": "n016",
      "type": "tap",
      "lane": 0,
      "time_ms": 7250,
      "duration_ms": 0,
      "phrase": 0,
      "accent": false,
      "section": "intro"
    },
    {
      "id": "n017",
      "type": "tap",
      "lane": 2,
      "time_ms": 7500,
      "duration_ms": 0,
      "phrase": 0,
      "accent": false,
      "section": "intro"
    },
    {
      "id": "n018",
      "type": "tap",
      "lane": 1,
      "time_ms": 8000,
      "duration_ms": 0,
      "phrase": 1,
      "accent": true,
      "section": "verse"
    },
    {
      "id": "n019",
      "type": "tap",
      "lane": 0,
      "time_ms": 8500,
      "duration_ms": 0,
      "phrase": 1,
      "accent": false,
      "section": "verse"
    },
    {
      "id": "n020",
      "type": "tap",
      "lane": 3,
      "time_ms": 9000,
      "duration_ms": 0,
      "phrase": 1,
      "accent": false,
      "section": "verse"
    },
    {
      "id": "n021",
      "type": "tap",
      "lane": 0,
      "time_ms": 9250,
      "duration_ms": 0,
      "phrase": 1,
      "accent": false,
      "section": "verse"
    },
    {
      "id": "n022",
      "type": "tap",
      "lane": 2,
      "time_ms": 9500,
      "duration_ms": 0,
      "phrase": 1,
      "accent": false,
      "section": "verse"
    },
    {
      "id": "n023",
      "type": "tap",
      "lane": 1,
      "time_ms": 10000,
      "duration_ms": 0,
      "phrase": 1,
      "accent": true,
      "section": "verse"
    },
    {
      "id": "n024",
      "type": "chord",
      "lane": 1,
      "time_ms": 10250,
      "duration_ms": 0,
      "phrase": 1,
      "accent": false,
      "section": "verse",
      "lanes": [
        0,
        1,
        3
      ]
    },
    {
      "id": "n025",
      "type": "tap",
      "lane": 0,
      "time_ms": 10500,
      "duration_ms": 0,
      "phrase": 1,
      "accent": false,
      "section": "verse"
    },
    {
      "id": "n026",
      "type": "tap",
      "lane": 3,
      "time_ms": 11000,
      "duration_ms": 0,
      "phrase": 1,
      "accent": false,
      "section": "verse"
    },
    {
      "id": "n027",
      "type": "tap",
      "lane": 0,
      "time_ms": 11250,
      "duration_ms": 0,
      "phrase": 1,
      "accent": false,
      "section": "verse"
    },
    {
      "id": "n028",
      "type": "tap",
      "lane": 2,
      "time_ms": 11500,
      "duration_ms": 0,
      "phrase": 1,
      "accent": false,
      "section": "verse"
    },
    {
      "id": "n029",
      "type": "tap",
      "lane": 1,
      "time_ms": 12000,
      "duration_ms": 0,
      "phrase": 1,
      "accent": true,
      "section": "verse"
    },
    {
      "id": "n030",
      "type": "chord",
      "lane": 0,
      "time_ms": 12250,
      "duration_ms": 0,
      "phrase": 1,
      "accent": true,
      "section": "verse",
      "lanes": [
        0,
        1,
        2,
        3
      ]
    },
    {
      "id": "n031",
      "type": "tap",
      "lane": 0,
      "time_ms": 12500,
      "duration_ms": 0,
      "phrase": 1,
      "accent": false,
      "section": "verse"
    },
    {
      "id": "n032",
      "type": "tap",
      "lane": 3,
      "time_ms": 13000,
      "duration_ms": 0,
      "phrase": 1,
      "accent": false,
      "section": "verse"
    },
    {
      "id": "n033",
      "type": "tap",
      "lane": 0,
      "time_ms": 13250,
      "duration_ms": 0,
      "phrase": 1,
      "accent": false,
      "section": "verse"
    },
    {
      "id": "n034",
      "type": "tap",
      "lane": 2,
      "time_ms": 13500,
      "duration_ms": 0,
      "phrase": 1,
      "accent": false,
      "section": "verse"
    },
    {
      "id": "n035",
      "type": "tap",
      "lane": 1,
      "time_ms": 14000,
      "duration_ms": 0,
      "phrase": 1,
      "accent": true,
      "section": "verse"
    },
    {
      "id": "n036",
      "type": "chord",
      "lane": 0,
      "time_ms": 14250,
      "duration_ms": 0,
      "phrase": 1,
      "accent": false,
      "section": "verse",
      "lanes": [
        0,
        2
      ]
    },
    {
      "id": "n037",
      "type": "tap",
      "lane": 0,
      "time_ms": 14500,
      "duration_ms": 0,
      "phrase": 1,
      "accent": false,
      "section": "verse"
    },
    {
      "id": "n038",
      "type": "tap",
      "lane": 3,
      "time_ms": 15000,
      "duration_ms": 0,
      "phrase": 1,
      "accent": false,
      "section": "verse"
    },
    {
      "id": "n039",
      "type": "tap",
      "lane": 0,
      "time_ms": 15250,
      "duration_ms": 0,
      "phrase": 1,
      "accent": false,
      "section": "verse"
    },
    {
      "id": "n040",
      "type": "tap",
      "lane": 2,
      "time_ms": 15500,
      "duration_ms": 0,
      "phrase": 1,
      "accent": false,
      "section": "verse"
    },
    {
      "id": "n041",
      "type": "tap",
      "lane": 1,
      "time_ms": 16000,
      "duration_ms": 0,
      "phrase": 2,
      "accent": true,
      "section": "verse"
    },
    {
      "id": "n042",
      "type": "tap",
      "lane": 0,
      "time_ms": 16500,
      "duration_ms": 0,
      "phrase": 2,
      "accent": false,
      "section": "verse"
    },
    {
      "id": "n043",
      "type": "tap",
      "lane": 3,
      "time_ms": 17000,
      "duration_ms": 0,
      "phrase": 2,
      "accent": false,
      "section": "verse"
    },
    {
      "id": "n044",
      "type": "tap",
      "lane": 0,
      "time_ms": 17250,
      "duration_ms": 0,
      "phrase": 2,
      "accent": false,
      "section": "verse"
    },
    {
      "id": "n045",
      "type": "tap",
      "lane": 2,
      "time_ms": 17500,
      "duration_ms": 0,
      "phrase": 2,
      "accent": false,
      "section": "verse"
    },
    {
      "id": "n046",
      "type": "tap",
      "lane": 1,
      "time_ms": 18000,
      "duration_ms": 0,
      "phrase": 2,
      "accent": true,
      "section": "verse"
    },
    {
      "id": "n047",
      "type": "tap",
      "lane": 0,